{
  "$schema": "../../community-submission-schema.json",
  "id": "host-icons",
  "repository": "https://github.com/ZarenOFF/termix-plugin-host-icons",
  "maintainers": ["ZarenOFF"],
  "versions": [
    {
      "version": "0.6.0",
      "sha256": "8672d7d8173f9dc8160b4281d4dd30f88ffeb374f8f01d3ee64384a1e47121b6"
    },
    {
      "version": "0.5.0",
      "sha256": "7ddd6cb9f65f3c8ab8b8555ff7a5374b46124d6b3517b0f92e836d738f11aa12"
    },
    {
      "version": "0.4.0",
      "sha256": "28b0bea5cca78096b2edda92243f2f0c94d30c4ff0ca176302614155bf77c3c4"
    },
    {
      "version": "0.3.0",
      "sha256": "cf393db45e39231841ef93fd15393df93fecae6139aeeaeb0322d04537b06431"
    },
    {
      "version": "0.2.0",
      "sha256": "9c9e2984575f4a1c5f95eb5596cede91bae7da66024ede685d36c04049f36e73"
    }
  ]
}
